{
  "party": "Green Party",
  "partyId": "green",
  "asOf": "2026-08-20",
  "policies": [
    {
      "id": "green-01",
      "title": "Affordable housing and rent controls",
      "statement": "Build large-scale social housing and introduce rent controls to address the housing crisis in urban areas.",
      "sourceUrl": "https://factually.co/fact-checks/politics/green-party-2026-policies-ca09df"
    },
    {
      "id": "green-02",
      "title": "Net zero by 2040",
      "statement": "Achieve net zero carbon emissions by 2040 through rapid transition to renewable energy and ending new North Sea oil and gas drilling.",
      "sourceUrl": "https://factually.co/fact-checks/politics/green-party-manifesto-promises-next-uk-general-election-after-2026-f18561"
    },
    {
      "id": "green-03",
      "title": "Public ownership of utilities",
      "statement": "Bring railways, water companies, and major energy companies into public ownership to reduce costs for consumers.",
      "sourceUrl": "https://simple.wikipedia.org/wiki/Green_Party_of_England_and_Wales"
    },
    {
      "id": "green-04",
      "title": "£15 minimum wage",
      "statement": "Introduce a £15 per hour minimum wage for all workers regardless of age by April 2027.",
      "sourceUrl": "https://greenparty.org.uk/workerscharter/"
    },
    {
      "id": "green-05",
      "title": "NHS funding and access",
      "statement": "Increase NHS funding to guarantee access to NHS dentists and same-day GP appointments for urgent needs.",
      "sourceUrl": "https://greenparty.org.uk/about/our-manifesto/building-a-fairer-healthier-country/"
    },
    {
      "id": "green-06",
      "title": "Nature restoration and clean air",
      "statement": "Enshrine the right to clean air through a Clean Air Act and restore rivers using nature-based flood solutions.",
      "sourceUrl": "https://factually.co/fact-checks/politics/green-party-manifesto-promises-next-uk-general-election-after-2026-f18561"
    }
  ]
}
