{
  "party": "Liberal Democrats",
  "partyId": "libdem",
  "asOf": "2026-08-20",
  "policies": [
    {
      "id": "libdem-01",
      "title": "GP access guarantee",
      "statement": "Guarantee everyone the right to see a GP within one week, or within 24 hours if the need is urgent.",
      "sourceUrl": "https://www.libdems.org.uk/press/release/lib-dems-are-the-first-political-party-to-adopt-pre-manifesto-with-right-to-see-a-gp-and-health-services-at-its-heart"
    },
    {
      "id": "libdem-02",
      "title": "Free personal care",
      "statement": "Introduce free personal care for older and disabled people in their own homes, funded by reversing tax cuts to major banks.",
      "sourceUrl": "https://feeds.bbci.co.uk/news/articles/cjmmww3ne8wo"
    },
    {
      "id": "libdem-03",
      "title": "End A&E 12-hour waits",
      "statement": "Put a legal duty on the Health Secretary to end 12-hour waits in accident and emergency departments by reserving care home places and funding more hospital discharge packages.",
      "sourceUrl": "https://www.libdems.org.uk/news/article/our-plan-to-end-the-ae-corridor-crisis"
    },
    {
      "id": "libdem-04",
      "title": "Proportional representation",
      "statement": "Replace the first-past-the-post electoral system with proportional representation for electing MPs and councillors in England.",
      "sourceUrl": "https://factually.co/fact-checks/politics/lib-dem-party-policies-2026-4f0529"
    },
    {
      "id": "libdem-05",
      "title": "Community policing guarantee",
      "statement": "Restore community policing and guarantee that every burglary will be attended by police and properly investigated.",
      "sourceUrl": "https://www.libdems.org.uk/news/article/speech-ed-davey-launches-liberal-democrat-manifesto-with-plan-to-save-the-nhs"
    },
    {
      "id": "libdem-06",
      "title": "Department for Growth",
      "statement": "Break up the Treasury and create a new Department for Growth based in Birmingham to drive regional economic rebalancing.",
      "sourceUrl": "https://factually.co/fact-checks/politics/lib-dem-party-policies-2026-4f0529"
    }
  ]
}
