{
  "party": "Labour Party",
  "partyId": "labour",
  "asOf": "2026-08-20",
  "policies": [
    {
      "id": "labour-01",
      "title": "Economic growth",
      "statement": "Achieve the highest sustained growth in the G7 to increase household incomes and fund better public services.",
      "sourceUrl": "https://nationalpolicyforum.labour.org.uk/wp-content/uploads/2026/03/NPF26_COMPLETE.pdf"
    },
    {
      "id": "labour-02",
      "title": "Clean power by 2030",
      "statement": "Deliver at least 95% clean electricity by 2030 through renewable energy expansion and the establishment of Great British Energy.",
      "sourceUrl": "https://feeds.bbci.co.uk/news/articles/cn9gxvppxqpo"
    },
    {
      "id": "labour-03",
      "title": "NHS recovery",
      "statement": "Reduce waiting lists by treating 92% of NHS patients within 18 weeks and increase annual appointments.",
      "sourceUrl": "https://nationalpolicyforum.labour.org.uk/wp-content/uploads/2026/03/NPF26_COMPLETE.pdf"
    },
    {
      "id": "labour-04",
      "title": "Housebuilding",
      "statement": "Build 1.5 million new homes and fast-track planning decisions on at least 150 major infrastructure projects.",
      "sourceUrl": "https://feeds.bbci.co.uk/news/articles/cn9gxvppxqpo"
    },
    {
      "id": "labour-05",
      "title": "Youth employment guarantee",
      "statement": "Provide six months of paid work for every 18-21 year old who has been on Universal Credit and searching for work for 18 months.",
      "sourceUrl": "https://nationalpolicyforum.labour.org.uk/wp-content/uploads/2026/03/NPF26_COMPLETE.pdf"
    },
    {
      "id": "labour-06",
      "title": "Immigration reform",
      "statement": "Restore order in the immigration system to build a firm and fair approach that addresses declining public trust.",
      "sourceUrl": "https://nationalpolicyforum.labour.org.uk/wp-content/uploads/2026/03/NPF26_COMPLETE.pdf"
    }
  ]
}
